{
  "name": "w2-smoke-hashline",
  "description": "SMOKE ONLY (never in w2_queue.json): Honest baseline plus the patched pi-hashline-context-edit 0.11.0 (hashline read/edit replacing the built-ins), vendored. Same as w2-hashline (no exaggeration needed).",
  "model": "garden/bonsai-agent",
  "worker_description": "Bonsai 2 27B (Ternary-Bonsai-2-27B, 2-bit), a local model on this machine's GPU",
  "thinking": "low",
  "max_output_tokens": 16384,
  "context_window": 81920,
  "compaction_reserve_tokens": 28672,
  "session_timeout_min": 8,
  "worker_memory": null,
  "extensions": [
    "autopilot/extensions/submit_request.ts",
    "bench/worker_eval/vendor/pi-hashline-context-edit@0.11.0",
    "bench/worker_eval/extensions/tool_audit.ts"
  ],
  "sources": {
    "model": "Historical operative snapshot c9c86b7338aa23ddcf0edd58493e1954d7eb7179:autopilot/config.json (SHA-256 27c9e40f7e845059626304f8f19b22f4cb341ef92d24964b05db972881bd3334) sets roles.worker.model to bonsai-agent; replay registers that historical ID as garden/bonsai-agent, as autopilot.py worker_agent_dir() does.",
    "worker_description": "autopilot.py worker_desc() for provider garden; the historical role model is c9c86b7338aa23ddcf0edd58493e1954d7eb7179:autopilot/config.json.",
    "thinking": "Historical operative snapshot c9c86b7338aa23ddcf0edd58493e1954d7eb7179:autopilot/config.json (SHA-256 27c9e40f7e845059626304f8f19b22f4cb341ef92d24964b05db972881bd3334) sets roles.worker.thinking to low.",
    "max_output_tokens": "Historical registration c9c86b7338aa23ddcf0edd58493e1954d7eb7179:agent/models.bonsai-agent.json (SHA-256 949819bb445f55604848e81e7b86c6da8e9591271322d143f663f8f27b9aabd4) sets maxTokens to 16384.",
    "context_window": "Historical registration c9c86b7338aa23ddcf0edd58493e1954d7eb7179:agent/models.bonsai-agent.json (SHA-256 949819bb445f55604848e81e7b86c6da8e9591271322d143f663f8f27b9aabd4) sets contextWindow to 81920.",
    "compaction_reserve_tokens": "autopilot.py worker_agent_dir(): settings compaction.reserveTokens 28672 for provider garden; this is the historical garden worker harness setting.",
    "session_timeout_min": "Historical c9c86b7338aa23ddcf0edd58493e1954d7eb7179:autopilot/config.json has worker_timeout_min 45; intentionally changed to 20 by the W1 milestone.",
    "worker_memory": "Historical c9c86b7338aa23ddcf0edd58493e1954d7eb7179:autopilot/config.json has worker_memory null; retained disabled because memory is W3.",
    "extensions": "Vendored copy bench/worker_eval/vendor/pi-hashline-context-edit@0.11.0 (LICENSE, vendor/PATCH.diff); advisor-approved exception to the gate, see vendor/REVIEW.md. tool_audit.ts only logs the tool list.",
    "prompt_timeout_min": "bonsai-2026-10-12-honest: the arm enforces 20 minutes, so the replayed prompt says 20 (W2 candidate 0).",
    "smoke": "bench/worker_eval/w2_smoke_queue.json; session_timeout_min lowered to 8 so several smoke arms fit in one 55-minute request."
  },
  "hypothesis": "Smoke variant of w2-hashline: exaggerated setting so the mechanism fires in a short case. Not a measurement arm.",
  "prompt_timeout_min": 20
}
