{
  "name": "w2-session-budget",
  "description": "Honest baseline plus an extension that warns at 12 and 16 minutes and at turns 30 and 40, and from 17.5 minutes or turn 45 allows only submit_request.",
  "model": "garden/bonsai-agent",
  "worker_description": "Bonsai 2 27B (Ternary-Bonsai-2-27B, 2-bit), a local model on this machine's GPU",
  "thinking": "low",
  "max_output_tokens": 16384,
  "context_window": 81920,
  "compaction_reserve_tokens": 28672,
  "session_timeout_min": 20,
  "worker_memory": null,
  "extensions": [
    "autopilot/extensions/submit_request.ts",
    "bench/worker_eval/extensions/session_budget.ts"
  ],
  "sources": {
    "model": "Historical operative snapshot c9c86b7338aa23ddcf0edd58493e1954d7eb7179:autopilot/config.json (SHA-256 27c9e40f7e845059626304f8f19b22f4cb341ef92d24964b05db972881bd3334) sets roles.worker.model to bonsai-agent; replay registers that historical ID as garden/bonsai-agent, as autopilot.py worker_agent_dir() does.",
    "worker_description": "autopilot.py worker_desc() for provider garden; the historical role model is c9c86b7338aa23ddcf0edd58493e1954d7eb7179:autopilot/config.json.",
    "thinking": "Historical operative snapshot c9c86b7338aa23ddcf0edd58493e1954d7eb7179:autopilot/config.json (SHA-256 27c9e40f7e845059626304f8f19b22f4cb341ef92d24964b05db972881bd3334) sets roles.worker.thinking to low.",
    "max_output_tokens": "Historical registration c9c86b7338aa23ddcf0edd58493e1954d7eb7179:agent/models.bonsai-agent.json (SHA-256 949819bb445f55604848e81e7b86c6da8e9591271322d143f663f8f27b9aabd4) sets maxTokens to 16384.",
    "context_window": "Historical registration c9c86b7338aa23ddcf0edd58493e1954d7eb7179:agent/models.bonsai-agent.json (SHA-256 949819bb445f55604848e81e7b86c6da8e9591271322d143f663f8f27b9aabd4) sets contextWindow to 81920.",
    "compaction_reserve_tokens": "autopilot.py worker_agent_dir(): settings compaction.reserveTokens 28672 for provider garden; this is the historical garden worker harness setting.",
    "session_timeout_min": "Historical c9c86b7338aa23ddcf0edd58493e1954d7eb7179:autopilot/config.json has worker_timeout_min 45; intentionally changed to 20 by the W1 milestone.",
    "worker_memory": "Historical c9c86b7338aa23ddcf0edd58493e1954d7eb7179:autopilot/config.json has worker_memory null; retained disabled because memory is W3.",
    "extensions": "bench/worker_eval/extensions/session_budget.ts",
    "prompt_timeout_min": "bonsai-2026-10-12-honest: the arm enforces 20 minutes, so the replayed prompt says 20 (W2 candidate 0).",
    "extension_config": "Thresholds fixed in bench/worker_eval/W2-decisions.md section 4; limit_min equals session_timeout_min."
  },
  "hypothesis": "Mechanism: 17 of 44 W1 attempts were killed at the time limit with no request. Warnings and a forced hand-over should convert some of them into a valid request (usually 'continue'). Expect valid rate up (about the timeout share), median wall time lower or equal, no_request count down; kind-match rate may rise only where the cloud kind was continue, so it could rise less than valid rate.",
  "prompt_timeout_min": 20,
  "extension_config": {
    "session_budget": {
      "limit_min": 20,
      "warn_min": [
        12,
        16
      ],
      "warn_turns": [
        30,
        40
      ],
      "block_min": 17.5,
      "block_turn": 45
    }
  }
}
